,Signatur,Titel,Zeit,Kontinent,Land,Kanton,Ort,E,N
157,Sozarch_F_5000-Fx-151,Einzelporträt Walter Brack (Wandervogel der Ortsgruppe Winterthur) auf der Wiese Akkordeon spielend (etwa 1913),,,,,,,
158,Sozarch_F_5000-Fx-152,Hohen Krähen - Gruppenporträt der Wandervögel der Ortsgruppe Winterthur vor dem Tor einer Burgruine (vermutlich) (1912),1912,Europa,GER,Baden-Württemberg,Mühlhausen,,
159,Sozarch_F_5000-Fx-153,Wandervögel der Ortsgruppe Winterthur kochen auf dem Feuer (vermutlich in der Nähe der Ruine Helfenberg) (1912),1912,Europa,CH,ZH,Winterthur,697278,260896
160,Sozarch_F_5000-Fx-154,Wandervögel der Ortsgruppe Winterthur laufen auf dem Schnee während einem Säntis-Tour (ca. 1911),1911-1920,Europa,CH,AR,,,
161,Sozarch_F_5000-Fx-155,Bergtour: Rast der Wandervögel der Ortsgruppe Winterthur bei einem Holzkreuz - Ein Wandervogel eine Geige tragend (1912),1912,Europa,CH,,,,
162,Sozarch_F_5000-Fx-156,Wandervogel-Zusammentreffen auf dem Pfannenstiel - Wandervögel der Ortsgruppe Winterthur am Rand eines Waldes (1911),1911,Europa,CH,,Pfannenstiel,,
163,Sozarch_F_5000-Fx-157,Wandervögel der Ortsgruppe Winterthur am Lagerfeuer in der Nähe eines Seelis (vermutlich) - Drei Kinder anwesend - Ein Wandervogel G,1911-1920,Europa,CH,,Seelis,,
164,Sozarch_F_5000-Fx-158,"Gruppenporträt der Wandervögel-Ortsgruppe Zürich-Altstadt, die bei einem Bauernhof (vermutlich) sitzen (1912)",1912,Europa,CH,ZH,"Zürich,",,
165,Sozarch_F_5000-Fx-159,"Wandervögel der Ortsgruppe Zürich-Altstadt sitzen auf der Wiese, ein Mädchen Gitarre spielend (1914)",1914,Europa,CH,ZH,"Zürich,",,
166,Sozarch_F_5000-Fx-160,Gruppenporträt der Wandervögel der Ortsgruppe Zürich-Altstadt im Wald bei Zollikerberg (1913),1913,Europa,CH,ZH,"Zürich,",,
167,Sozarch_F_5000-Fx-161,Auf dem Schiff - Gruppenporträt Wandervögel der Ortsgruppe Zürich (1914),1914,Europa,CH,ZH,"Zürich,",,
168,Sozarch_F_5000-Fx-162,"Wandervögel der Ortsgruppe Zürich auf der Strasse, ein Wandervogel Trompete spielend (1913)",1913,Europa,CH,ZH,"Zürich,",,
169,Sozarch_F_5000-Fx-163,Einzelporträt Sophie Zoller (Wandervogel-Mädchen der Ortsgruppe Zürich) mit den Skis auf dem Schnee sitzend (Februar 1916),,,,,,,
170,Sozarch_F_5000-Fx-164,"Wandervögel der Ortsgruppe Zürich (OG Turicum) sitzen auf der Wiese beim Meilener Hüttli, ein Mädchen Akkordeon spielend (Sonnenwend",1916,Europa,CH,ZH,"Zürich,",,
171,Sozarch_F_5000-Fx-165,Wandervögel der Ortsgruppe Zürich sitzen auf einem Boot und auf einem Floss am See (1913),1913,Europa,CH,ZH,"Zürich,",,
172,Sozarch_F_5000-Fx-166,Wandervögel der Ortsgruppe Zürich beim Heimmarsch auf dem Zürichberg (1912),1912,Europa,CH,ZH,"Zürich,",,
173,Sozarch_F_5000-Fx-167,Gruppenporträt der Wandervögel der Ortsgruppe Zürich - Gründung der Ortsgruppe Turicum an der Wandervogel-Landsgemeinde (1916),1916,Europa,CH,ZH,"Zürich,",,
174,Sozarch_F_5000-Fx-168,Wandervögel der Ortsgruppe Zürich wandern in den Bergen (Tödifahrt) (Sommer 1941),1941,Europa,CH,ZH,"Zürich,",,
175,Sozarch_F_5000-Fx-169,Wandervögel der Ortsgruppe Zürich sitzen auf den Steinen bei einem Wasserlauf (vermutlich für eine Rast) (Tödifahrt) (Sommer 1941),1941,Europa,CH,ZH,"Zürich,",,
176,Sozarch_F_5000-Fx-170,"Wandervögel der Ortsgruppe Zürich, in Seilschaft auf dem Tödi (gedeckt mit Schnee) (Tödifahrt) (Sommer 1941)",1941,Europa,CH,ZH,"Zürich,",,
177,Sozarch_F_5000-Fx-171,Auf dem Jöriflesspass (Graubünden): Rast der Wandervögel in Graubünden (zwei Kinder anwesend) - Grosse Fahrt von Emmi Bloch (1887-19,1909,Europa,CH,GR,,,
178,Sozarch_F_5000-Fx-172,Livignotal - Wandervögel in Graubünden - Grosse Fahrt von Emmi Bloch (1887-1978) (1909),1909,Europa,IT,Lombardia,Livignotal,,
179,Sozarch_F_5000-Fx-173,Gruppenporträt der Wandervögel beim Quartier in Livigno - Wandervögel in Graubünden - Grosse Fahrt von Emmi Bloch (1887-1978) (1909),1909,Europa,IT,Lombardia,Livigno,,
180,Sozarch_F_5000-Fx-174,Rast auf der Forcola di Livigno - Wandervögel in Graubünden - Grosse Fahrt 1909 von Emmi Bloch (1887-1978) (1909),1909,Europa,CH,GR,Ital,,
181,Sozarch_F_5000-Fx-175,"Lager-Idylle (Poschiavo, Le Rese) - Wandervögel in Graubünden - Grosse Fahrt von Emmi Bloch (1887-1978) - Aufgehängte Wäsche - Wande",1909,Europa,CH,GR,Poschiavo,801993,133837
182,Sozarch_F_5000-Fx-176,Ansicht der Alp La Fopa (1800 m.) - Wandervögel in Graubünden - Grosse Fahrt von Emmi Bloch (1887-1978) (1909),1909,Europa,CH,GR,,,
183,Sozarch_F_5000-Fx-177,Beim Mittagsmahl - Wandervögel in Graubünden - Grosse Fahrt von Emmi Bloch (1887-1978) (1909),1909,Europa,CH,GR,,,
184,Sozarch_F_5000-Fx-178,Giacomopass - Grosse Fahrt von Emmi Bloch (1887-1978) - Wandervögel in Badeanzug bei einem Bach (1910),1910,Europa,CH,TI,,,
185,Sozarch_F_5000-Fx-179,Abends bei den Morasthütten - Wandervögel sitzen auf der Wiese - Grosse Fahrt von Emmi Bloch (1887-1978) (1910),1910,Europa,CH,TI,,,
186,Sozarch_F_5000-Fx-180,Marschbereit - Wandervögel in Seilschaft laufen auf dem Hohsandgletscher - Grosse Fahrt von Emmi Bloch (1887-1978) (1910),1910,Europa,IT,,,,
187,Sozarch_F_5000-Fx-181,"Am Sonntagmorgen in Binn (Binntal, Wallis): Dorfbewohner (vermutlich) bei der Brücke, im Hintergrund ist die Dorfkirche sichtbar - G",1910,Europa,CH,VS,Binntal,,
188,Sozarch_F_5000-Fx-182,Saasertal - Ansicht der Kirche; Wandervögel unterwegs mit Zeltplanen auf den Schultern (Regenschutz) - Grosse Fahrt von Emmi Bloch (,1910,Europa,CH,VS,,,
189,Sozarch_F_5000-Fx-183,Anzasca-Tal - Wandervögel bei einer Rast (Vermutlich) - Ansicht eines Bergdorfes - Grosse Fahrt von Emmi Bloch (1887-1978) (1910),1910,Europa,IT,,,,
190,Sozarch_F_5000-Fx-184,Lagerleben: Wandervögel im Tessin oder im Wallis - Grosse Fahrt von Emmi Bloch (1887-1978) (1910),1910,Europa,CH,TI,,,
191,Sozarch_F_5000-Fx-185,Wandervögel auf einem Schotterweg bei Olivone (Bleniotal) - Grosse Fahrt von Emmi Bloch (1887-1978) (1910),1910,Europa,CH,TI,Bleniotal,,
192,Sozarch_F_5000-Fx-186,Auf dem Jöriflesspass (Graubünden): Rast der Wandervögel in Graubünden (zwei Kinder anwesend) - Grosse Fahrt von Emmi Bloch (1887-19,1909,Europa,CH,GR,,,
193,Sozarch_F_5000-Fx-187,Wandervögel bei einem Bach im Graubünden - Grosse Fahrt von Peter Jud (1909),1909,Europa,CH,GR,,,
194,Sozarch_F_5000-Fx-188,Gruppenporträt der Wandervögel in Graubünden (vermutlich bei einem aus Gestein gemachten Brückenpfeiler) - Im Hintergrund sind die v,1909,Europa,CH,GR,,,
195,Sozarch_F_5000-Fx-189,Wandervögel bei einem See in Graubünden (ein Wandervogel im See stehend) - Grosse Fahrt von Peter Jud (1909),1909,Europa,CH,GR,,,
196,Sozarch_F_5000-Fx-190,Wandervögel in Graubünden beobachten die Landschaft: Ansicht der Berge und des Tals - Grosse Fahrt von Peter Jud (1909),1909,Europa,CH,GR,,,
197,Sozarch_F_5000-Fx-191,Nollen - Wandervögel tanzen auf der Wiese (1914),1914,Europa,CH,ZH,Winterth,,
198,Sozarch_F_5000-Fx-192,"Wandervögel der Ortsgruppe Winterthur auf der Wiese, ein Junge Gitarre spielend (1912 oder 1914)",1914,Europa,CH,,,,
199,Sozarch_F_5000-Fx-193,Tisch der Bundesleitung an der Wandervogel-Landsgemeinde Steinmaur (Heitliberg) - Wandervögel sitzen auf der Wiese (1915),1915,Europa,CH,ZH,Steinmaur,676630,261426
200,Sozarch_F_5000-Fx-194,Menschenmenge auf der Wiese an der Wandervogel-Landsgemeinde in Steinmaur (Heitliberg) (1915),1915,Europa,CH,ZH,Steinmaur,676630,261426
201,Sozarch_F_5000-Fx-195,Wandervögel bilden einen Kreis auf der Wiese (vermutlich für einen Tanz) an der Wandervogel-Landsgemeinde bei Buonas am Zugersee - M,1916,Europa,CH,ZG,Risch,677862,220696
202,Sozarch_F_5000-Fx-196,"Kayen - Vier Wandervögel (Männer) mit nacktem Oberkörper liegen oder sitzen auf der Wiese - ""Sonne!"" (Ostern 1914)",1914,Europa,CH,ZH,Winterth,,
203,Sozarch_F_5000-Fx-197,Rast (vermutlich) beim Aufstieg auf die Fuorcla Surlej - [Fuorcla Surlej bei Silvaplana und St. Moritz] (Sommer 1913),1913,Europa,CH,GR,,,
204,Sozarch_F_5000-Fx-198,An der Tränke - Wandervögel trinken aus einem kleinen Bach in den Bergen (Sommer 1913),1913,Europa,CH,ZH,Winterth,,
205,Sozarch_F_5000-Fx-199,Karl Beck erzählt einen Witz - Wandervögel kochen auf dem Feuer in den Bergen in Engadin (Sommer 1913),1913,Europa,CH,GR,,,
206,Sozarch_F_5000-Fx-200,"Der erste Blätz - Wandervogel, barfuss, in den Bergen in Engadin sitzend (vermutlich eine Luftblase am Fuss pflegend) (1913)",1913,Europa,CH,ZH,Winterth,,
207,Sozarch_F_5000-Fx-201,"¨""Schuhnägelparade"" - Fünf Wandervögel der Wandervogel-Ortsgruppe Aarau liegen mit dem Bauch auf der Wiese - Fotoalbum von Paul Burk",1912,Europa,CH,AG,Aarau,646060,248866
208,Sozarch_F_5000-Fx-202,Rast auf der Wiese der Wandervogel-Ortsgruppe Aarau (vermutlich während einer Wanderung) - Fotoalbum von Paul Burkhart (1913),1913,Europa,CH,AG,Aarau,646060,248866
209,Sozarch_F_5000-Fx-203,Kopfparade - Wandervögel der Wandervogel-Ortsgruppe Aarau bilden einen Menschenhaufen auf der Wiese - Fotoalbum von Paul Burkhart (1,1913,Europa,CH,AG,Aarau,646060,248866
210,Sozarch_F_5000-Fx-204,"Wandervögel der Wandervogel-Ortsgruppe ""nach dem Mittagessen"" (vermutlich während eines Lagers) - Fotoalbum von Paul Burkhart (1913)",1913,Europa,CH,AG,Aarau,646060,248866
211,Sozarch_F_5000-Fx-205,Wandervogel-Landsgemeinde auf dem Bantiger bei Bern: Versammelte Wandervögel sitzen auf der Wiese - Fotoalbum von Paul Burkhart (191,1914,Europa,CH,BE,Bolligen,604386,202664
212,Sozarch_F_5000-Fx-206,Wandervögel der Wandervogelortsgruppe Aarau kochen auf dem Feuer (am Pilatus über dem Nebelmeer) - Fotoalbum von Paul Burkhart (Nove,1915,Europa,CH,NW,,,
213,Sozarch_F_5000-Fx-207,Wandervögel der Wandervogel-Ortsgruppe Aarau sitzen auf einem Boot oder stehen im See - Fotoalbum von Paul Burkhart (1913),1913,Europa,CH,AG,Aarau,646060,248866
214,Sozarch_F_5000-Fx-208,Gruppenporträt der Wandervogel-Ortsgruppe Zürich-Altstadt während einer Mahlzeit im Wald (1912),1912,Europa,CH,ZH,"Zürich,",,
215,Sozarch_F_5000-Fx-209,Wandervögel der Wandervogel-Ortsgruppe Zürich-Altstadt sitzen oder stehen bei einem abgeholzten Stammbaum während einer Mahlzeit (19,1912,Europa,CH,ZH,"Zürich,",,
216,Sozarch_F_5000-Fx-210,Wandervögel der Wandervogel-Ortsgruppe Zürich-Altstadt bilden eine horizontale Kette und gehen mit den Nachbarn Arm in Arm eingehack,1912,Europa,CH,ZH,"Zürich,",,
217,Sozarch_F_5000-Fx-211,Wandervögel der Wandervogel-Ortsgruppe Zürich-Altstadt spielen (vermutlich) auf der Wiese (1912),1912,Europa,CH,ZH,"Zürich,",,
218,Sozarch_F_5000-Fx-212,Wandervogel-Ortsgruppe Zürich-Altstadt (1912),1912,Europa,CH,ZH,"Zürich,",,
219,Sozarch_F_5000-Fx-213,"Gruppenporträt der Wandervogel-Ortsgruppe Zürich-Altstadt , welche im Wald (vermutlich) sitzen oder stehen (1912)",1912,Europa,CH,ZH,"Zürich,",,
220,Sozarch_F_5000-Fx-214,Wandervogel (Mädchen) der Wandervogel-Ortsgruppe Zürich-Altstadt Akkordeon spielend (1914),1914,Europa,CH,ZH,"Zürich,",,
221,Sozarch_F_5000-Fx-215,Wandervogel (Mädchen) der Wandervogel-Ortsgruppe Zürich-Altstadt mit den Skis auf dem Schnee (1914),1914,Europa,CH,ZH,"Zürich,",,
222,Sozarch_F_5000-Fx-216,Wandervögel der Wandervogel-Ortsgruppe Zürich-Altstadt bilden eine horizontale Kette und gehen mit den Nachbarn Arm in Arm eingehack,1914,Europa,CH,ZH,"Zürich,",,
223,Sozarch_F_5000-Fx-217,Wandervogel-Ortsgruppe Zürich-Altstadt: Mann in Militäruniform (vermutich) mit zwei Wandervögeln (1914),1914,Europa,CH,ZH,"Zürich,",,
224,Sozarch_F_5000-Fx-218,Wandervögel der Wandervogel-Ortsgruppe Zürich-Altstadt bilden einen Kreis und halten ein Tuch - Junge in der Mitte des Tuches in die,1914,Europa,CH,ZH,"Zürich,",,
225,Sozarch_F_5000-Fx-219,Wandervogel-Ortsgruppe Zürich-Altstadt bei einem Ausflug (vermutlich) - Überschwemmung in Locarno (1914),1914,Europa,CH,ZH,"Zürich,",,
226,Sozarch_F_5000-Fx-220,Wandervögel der Wandervogel-Ortsgruppe Winterthur in Engadin: Lagerleben - Ein Wandervogel Gitarre spielend (1926),1926,Europa,CH,,Engadin,,
227,Sozarch_F_5000-Fx-221,Wandervögel der Wandervogel-Ortsgruppe Winterthur in Engadin - Lagerleben (vermutlich) (1926),1926,Europa,CH,,Engadin,,
228,Sozarch_F_5000-Fx-222,"Wandervögel der Wandervogel-Ortsgruppe Winterthur sitzen auf der Wiese, am Rand eines Waldes (vermutlich), in Engadin (1926)",1926,Europa,CH,,Engadin,,
229,Sozarch_F_5000-Fx-224,Mitglied der Wandervogel-Ortsgruppe Winterthur im Freien kochend (1926),1926,Europa,CH,,,,
230,Sozarch_F_5000-Fx-225,Gruppenporträt der Wandervogel-Ortsgruppe Winterthur am Bözberg (1925),1925,Europa,CH,,Bözberg,,
231,Sozarch_F_5000-Fx-226,Wandervögel der Ortsgruppe Winterthur liegen auf der Wiese eines Kirchenkreuzgangs (vermutlich) in Morcote - Teilansicht des Glocken,1927,Europa,CH,,Morcote,,
232,Sozarch_F_5000-Fx-227,Ferienwoche der Wandervogel-Ortsgruppe Winterthur in Hinter-Goldingen: Lagerleben (1927),1927,Europa,CH,,Hinter-Goldingen,,
233,Sozarch_F_5000-Fx-228,Berner Wandervögel sitzen auf der Wiese bei der Senggihütte am Niesen (beim Lesen eines Buches oder beim Gitarre Spielen) (1916),1916,Europa,CH,BE,Aeschi bei,,
234,Sozarch_F_5000-Fx-229,Wandervogel auf der Senggi am Niesen ob Reichenbach wandernd (1916),1916,Europa,CH,BE,Bern,601018,203269
235,Sozarch_F_5000-Fx-230,Wandervögel in einem Wald beim Krauchthal (1916),1916,Europa,CH,BE,Krauchthal,609877,206445
236,Sozarch_F_5000-Fx-231,Wandervögel OG Bern trinken (vermutlich bei einer Rast) in der Nähe eines Waldes und eines Bachs (1916),1916,Europa,CH,BE,Bern,601018,203269
237,Sozarch_F_5000-Fx-232,Berner Wandervögel auf dem Lämmerengletscher (in Seilschaft) (1916),1916,Europa,CH,,Lämmerengletscher,,
238,Sozarch_F_5000-Fx-233,Gruppenporträt der Wandervögel OG St. Gallen in Birrwil am Hallwilersee (vermutlich an der Landsgemeinde) - Zwei Wandervögel haben e,1912,Europa,CH,SG,St.,,
239,Sozarch_F_5000-Fx-234,Tanzende Wandervögel auf dem Rossbüchel (1914),1914,Europa,CH,SG,Grub,,
240,Sozarch_F_5000-Fx-235,Tanzende Wandervögel auf dem Bantiger bei Bern (vermutlich während der Wandervogel-Landsgemeinde) - Wandervogel Geige spielend (1914,1914,Europa,CH,BE,Bolligen,604386,202664
241,Sozarch_F_5000-Fx-236,Tanzende Wandervögel bei Steinmaur (Heitliberg) (vermutlich während der Wandervogel-Landsgemeinde) (1915),1915,Europa,CH,ZH,Steinmaur,676630,261426
242,Sozarch_F_5000-Fx-237,Tanzende Wandervögel bei Steinmaur (Heitliberg) (vermutlich während der Wandervogel-Landsgemeinde) (1915),1915,Europa,CH,ZH,Steinmaur,676630,261426
243,Sozarch_F_5000-Fx-238,Stube der (Wandervogel-)Hütte Girlen bei Ebnat-Kappel - Holzhofen und Gitarre (1912),1912,Europa,CH,SG,Ebnat,,
244,Sozarch_F_5000-Fx-239,Wasserfahrt auf der Au: Wandervögel kochen auf dem Feuer in der Nähe des Flusses (vermutlich) (1914),1914,Europa,CH,,,,
245,Sozarch_F_5000-Fx-240,Wasserfahrt auf der Au: Zwei Frauen rudern auf einem Ruderboot (1914),1914,Europa,CH,,,,
246,Sozarch_F_5000-Fx-241,Wasserfahrt (1914),1914,Europa,CH,,,,
247,Sozarch_F_5000-Fx-242,An den Faletschen (?) - Wandervögel schauen das Panorama während einer Wanderung (vermutlich) (1915),1915,Europa,CH,ZH,,,
248,Sozarch_F_5000-Fx-243,"Drei Wandervögel (Frauen) liegen ode sitzen auf der Wiese, ein Junge Gitarre spielend (1915)",1915,Europa,CH,,,,
249,Sozarch_F_5000-Fx-244,Hinter dem Bauernhaus in Orvin wird eifrig gegessen (1942),1942,Europa,CH,BE,Orvin,583146,223154
250,Sozarch_F_5000-Fx-245,Auf dem Hochplateau wird ein hitziger Völkerball ausgefochten - Tanzende Wandervögel auf der Wiese in Orvin (1942),1942,Europa,CH,BE,Orvin,583146,223154
251,Sozarch_F_5000-Fx-246,Schnappschuss aus dem hitzigen Völkerball in Orvin (1942),1942,Europa,CH,BE,Orvin,583146,223154
252,Sozarch_F_5000-Fx-247,"Das Hofsingen kann beginnen - Gruppenporträt Wandervögel: Zwei Wandervögel spielen Gitarre, ein Wandervogel Geige tragend (1936)",1936,Europa,CH,BE,Orvin,583146,223154
253,Sozarch_F_5000-Fx-248,Morgenfeier - Versammelte Wandervögel auf der Wiese: Zwei Wandervögel spielen Gitarre (1937),1937,Europa,CH,BE,Orvin,583146,223154
254,Sozarch_F_5000-Fx-249,Wandervögel fahren mit den Velos: Abfahrt an (sic) der Reuchenettestrasse (1942),1942,Europa,CH,BE,Orvin,583146,223154
255,Sozarch_F_5000-Fx-250,Wandervogel-Landsgemeinde auf dem Sonnenberg (?) - Versammelte Wandervögel auf der Wiese vor einem Bauernhof (1922),1921-1930,Europa,CH,SG,St.,,
256,Sozarch_F_5000-Fx-251,Wandervogel-Landsgemeinde auf dem Sonnenberg (?) - Wandervögel bei einem Spiel (vermutlich) im Freien (1922),1921-1930,Europa,CH,,,,
257,Sozarch_F_5000-Fx-254,"Wandervögel sitzen auf der Wiese, ein Wandervogel Mandoline spielend, ein Wandervogel die Geige tragend - OG Züri-Züri am Zugersee (",1919,Europa,CH,ZH,"Zürich,",,
258,Sozarch_F_5000-Fx-255,Wandervögel tanzen auf der Wiese - OG Züri-Züri am Zugersee (1919),1919,Europa,CH,ZH,"Zürich,",,
259,Sozarch_F_5000-Fx-256,Wandervogel-Landsgemeinde in Hombrechtikon - Wandervögel bei einem Spiel (vermutlich) im Freien (1919),1919,Europa,CH,ZH,Hombrechtikon,700313,234409
260,Sozarch_F_5000-Fx-257,Wandervogel-Landsgemeinde in Hombrechtikon - Ein Wandervogel Gitarre spielend; versammelte Wandervögel stehen oder sitzen rund um de,1919,Europa,CH,ZH,Hombrechtikon,700313,234409
261,Sozarch_F_5000-Fx-258,Wandervogel-Landsgemeinde in Hombrechtikon - Einzelporträt Wandervogel Gitarre spielend (1919),1919,Europa,CH,ZH,Hombrechtikon,700313,234409
262,Sozarch_F_5000-Fx-259,"Wandervögel, zum Teil mit nacktem Oberkörper, rennen auf der Wiese (vermutlich beim Spielen) - Führertag Fischbach (Herbst 1919)",1919,Europa,CH,,,,
263,Sozarch_F_5000-Fx-260,Wandervögel spielen (vermutlich) auf der Wiese - Führertag Fischbach (Herbst 1919),1919,Europa,CH,,,,
264,Sozarch_F_5000-Fx-261,Wandervogel-Landsgemeinde beim Schloss Hallwil - Wandervögel spielen (vermutlich) auf der Wiese (Pfingsten 1920),1920,Europa,CH,AG,Seengen,657785,242006
265,Sozarch_F_5000-Fx-262,Wandervogel-Landsgemeinde beim Schloss Hallwil - Wandervögel spielen mit einem Ball im Freien (1920),1920,Europa,CH,AG,Seengen,657785,242006
266,Sozarch_F_5000-Fx-263,Wandervögel sitzen im Wald: Zusammenkunft Aargau & Basel auf der Schafmatt (1920),1920,Europa,CH,,,,
267,Sozarch_F_5000-Fx-264,Versammelte Wandervögel auf der Wiese an der Wandervogel-Landsgemeinde in Hüttwilen (1921),1921,Europa,CH,TG,Hüttwilen,708065,274072
268,Sozarch_F_5000-Fx-265,Zwei Wandervögel (Frauen) sitzen und liegen auf der Wiese während der Wandervogel-Landsgemeinde in Hüttwilen - Eine junge Frau ihren,1921,Europa,CH,TG,Hüttwilen,708065,274072
269,Sozarch_F_5000-Fx-266,Versammelte Wandervögel beim Maibaum an einer Wandervogel-Landsgemeinde (um 1920),1921-1930,Europa,CH,,,,
270,Sozarch_F_5000-Fx-267,Theater spielende Wandervögel im Freien (um 1920),1921-1930,Europa,CH,,,,
271,Sozarch_F_5000-Fx-268,"Mädchen einer Zürcher Wandervogelgruppe liegen oder sitzen auf der Wiese (vermutlich nach einer Mahlzeit, da eine Kochpfanne und zwe",1921-1930,Europa,CH,ZH,,,
272,Sozarch_F_5000-Fx-269,Drei Wandervögel spielen Querflöte und ein Wandervogel spielt Geige in einer mit einem Tuch gebauten Hütte im Wald (um 1921),1921-1930,Europa,CH,,,,
273,Sozarch_F_5000-Fx-270,Prellen - Spiel im Freien: Wandervögel halten ein Tuch: In der Mitte des Tuches ein Wandervogel in die Luft springend (1920),1920,Europa,CH,,,,
274,Sozarch_F_5000-Fx-271,Zwei tanzende Wandervögel im Freien (um 1920),1921-1930,Europa,CH,,,,
275,Sozarch_F_5000-Fx-272,Fahrt der Wandervogel-Mädchen Richterswil - Wandervögel rutschen auf dem Schnee anhand eines Tuches (vermutlich) (1921),1921,Europa,CH,,,,
276,Sozarch_F_5000-Fx-273,"Fahrt der Wandervogel-Mädchen Richterswil - Wandervögel sitzen vor einem Bauernhof (vermutlich), Trudy Sennhauser die Gitarre auf de",1921,Europa,CH,,,,
277,Sozarch_F_5000-Fx-275,Gruppenporträt von Schweizerwandervögeln auf einer Schwarzwaldfahrt (1908),1908,Europa,GER,,,,
278,Sozarch_F_5000-Fx-276,Gruppenporträt der Wandervögel in Lugano (um 1910),1901-1910,Europa,CH,TI,Lugano,716806,95995
279,Sozarch_F_5000-Fx-277,Von einer Bündnerfahrt - Drei Kinder tragen einen Stock und posieren zusammen mit Kühen auf einem Saumpfad (1913),1913,Europa,CH,GR,,,
280,Sozarch_F_5000-Fx-278,Von einer Bündnerfahrt - Drei Erwachsene und drei Kinder sitzen auf einer Holzbank vor einem Haus (1913),1913,Europa,CH,GR,,,
281,Sozarch_F_5000-Fx-279,"Ansicht vom Aabach und von der Brücke bei Hallwil, Aargau (1914)",1914,Europa,CH,AG,Hallwil,655731,242242
282,Sozarch_F_5000-Fx-280,Wandervogel-Ortsgruppe Aarau-Kantonsschule beim Herdbau im Jura (um 1914),1911-1920,Europa,CH,AG,Aarau,646060,248866
283,Sozarch_F_5000-Fx-281,Bei einer Rast (vermutlich) während einer Wanderung - Auf Krüzlipass (?) [Krüzlipass bei Sedrun] (1914),1914,Europa,CH,GR,,,
284,Sozarch_F_5000-Fx-282,"Bei einer Rast (vermutlich) während einer Wanderung: Wandervögel spielen Gitarre, Geige und Querflöte - Vor der Sefinenfurgge [Sefin",1914,Europa,CH,BE,,,
285,Sozarch_F_5000-Fx-283,Gruppenporträt der Wandervogel-Ortsgruppe Turicum bei einem Brunnen vor einem Bauernhof (1914),1914,Europa,CH,ZH,"Zürich,",,
286,Sozarch_F_5000-Fx-284,"Gruppenporträt der Wandervögel, welche, zusammen mit einem Kalb, bei einem Bretterzaun posieren - Drei Wandervögel spielen Gitarre (",1911-1920,Europa,CH,,,,
287,Sozarch_F_5000-Fx-285,"Zürcher Wandervögel in den verschneiten Bergen (Engadin) - Zwei Wandervögel spielen Block- und Querflöte, vier Wandervögel tanzen au",1911-1920,Europa,CH,ZH,,,
288,Sozarch_F_5000-Fx-286,"Wandervogel-Bundeshütte bis 1914 - Beschriftung: ""Gr. Hotel Wandervogel"" Golzeren",1914,Europa,CH,UR,,,
289,Sozarch_F_5000-Fx-287,Gruppenporträt der Wandervögel vor der Kientalhütte (Sommer 1913),1913,Europa,CH,BE,Reichenbac,,
290,Sozarch_F_5000-Fx-288,"Gruppenporträt der Wandervögel auf dem Dach (Dach mit Schindeln) der Butzenalp-Wandervogelhütte - Ein Wandervogel Gitarre spielend,",1915,Europa,CH,SZ,Riemenst,,
291,Sozarch_F_5000-Fx-289,"Winkelweid bei Wildhaus (Golzern, Maderanertal) - Wandervögel spielen mit Spielkarten - Petroleumlampe (Weihnachten 1913)",1913,Europa,CH,UR,,,
292,Sozarch_F_5000-Fx-290,Familie Hausknecht (1914),1914,Europa,CH,,,,
293,Sozarch_F_5000-Fx-291,Herr Hausknecht mit Kind (1914),1914,Europa,CH,,,,
294,Sozarch_F_5000-Fx-292,Wandervogel-Landsgemeinde in Kyburg - Wandervögel sitzen am Tisch im Freien (1910),1910,Europa,CH,ZH,Kyburg,698482,257153
295,Sozarch_F_5000-Fx-293,Gruppenporträt der Wandervögel an der Wandervogel-Landsgemeinde in Birrwil am Hallwilersee (1912),1912,Europa,CH,AG,Birrwil,657421,237973
296,Sozarch_F_5000-Fx-294,Wandervögel an der Wandervogel-Landsgemeinde in Altenklingen sitzen und tanzen auf der Wiese - Im Hintergrund ist das Schloss Altenk,1913,Europa,CH,TG,Märstetten,722639,272745
297,Sozarch_F_5000-Fx-295,"Wandervogel-Landsgemeinde auf dem Bantiger bei Bern: Die Leitung (vermutlich) am Tisch sitzend, ein Wandervogel eine Rede haltend (1",1914,Europa,CH,BE,Bolligen,604386,202664
298,Sozarch_F_5000-Fx-296,Wandervögel an der Wandervogel-Landsgemeinde bei Steinmaur (Heitliberg) tanzen auf der Wiese (1915),1915,Europa,CH,ZH,Steinmaur,676630,261426
299,Sozarch_F_5000-Fx-297,Gruppenporträt der Wandervögel (die Mehrheit von ihnen den Essnapf in den Händen tragend) an der Wandervogel-Landsgemeinde bei Stein,1915,Europa,CH,ZH,Steinmau,,
300,Sozarch_F_5000-Fx-298,Gruppenporträt der Wandervögel in den Bergen (1914),1914,Europa,CH,,,,
301,Sozarch_F_5000-Fx-299,"Wandervögel sitzen auf der Wiese am Rand eines Wald; ein Wandervogel Gitarre, ein Wandervogel Blockflöte spielend (1914)",1914,Europa,CH,,,,
302,Sozarch_F_5000-Fx-300,Versammelte Wandervögel sitzen auf der Wiese an der Wandervogel-Landsgemeinde in Biberstein - Ein Wandervogel anhand eines Stativs m,1918,Europa,CH,AG,Biberstein,648495,251881
303,Sozarch_F_5000-Fx-301,Gruppenporträt der Zürcher Ortsgruppe (?) an der Wandervogel-Landsgemeinde in Biberstein - Steinpflaster (1918),1918,Europa,CH,ZH,"Zürich,",,
304,Sozarch_F_5000-Fx-302,Zwei tanzende Wandervögel am Rand eines Waldes (um 1914),1911-1920,Europa,CH,,,,
305,Sozarch_F_5000-Fx-303,"Drei Wandervögel sitzen auf einem Ruderboot, ein Wandervogel rudernd (1914)",1914,Europa,CH,,,,
306,Sozarch_F_5000-Fx-304,"Wandervogelgruppe auf der Wiese sitzend, ein Wandervogel Gitarre spielend (1914)",1914,Europa,CH,,,,
307,Sozarch_F_5000-Fx-305,Wandervögel sitzen im Wald während der Ferienwoche in Feldis (1923),1923,Europa,CH,GR,Tomils,,
308,Sozarch_F_5000-Fx-306,Wandervogel auf einem Skitour (vermutlich) rund um Feldis (1923),1923,Europa,CH,GR,Tomils,,
309,Sozarch_F_5000-Fx-307,Wandervogel-Landsgemeinde auf dem Sonnenberg - Wandervögel sitzen auf der Wiese und schöpfen die Speise aus der Pfanne - Radfahrer/i,1923,Europa,CH,,,,
310,Sozarch_F_5000-Fx-308,Versammelte Wandervögel an der Wandervogel-Landsgemeinde auf dem Sonnenberg (1923),1923,Europa,CH,,,,
311,Sozarch_F_5000-Fx-309,Wandervögel sind während der Wandervogel-Landsgemeinde am Himmelbach in Oberglatt unterwegs - Riegelbau (1924),1924,Europa,CH,ZH,Oberglatt,,
312,Sozarch_F_5000-Fx-310,Einzelporträt Josef Spichtig in den Bergen (1918),,,,,,,
313,Sozarch_F_5000-Fx-311,Wandervögel warten auf die Speise - Holzöfen und Kochkessel (1918),1918,Europa,CH,,,,
314,Sozarch_F_5000-Fx-312,"Tanzende Wandervögel auf der Wiese, ein Wandervogel Gitarre spielend (1918)",1918,Europa,CH,,,,
315,Sozarch_F_5000-Fx-313,Wandervögel vor dem Denkmal der Schlacht von Näfels (1920),1920,Europa,CH,GL,Glarus N,,
316,Sozarch_F_5000-Fx-314,Tanzende Wandervögel (an einer Wandervogel-Landsgemeinde?) (1920),1920,Europa,CH,,,,
317,Sozarch_F_5000-Fx-315,Wandervögel bei einer Rast (vermutlich) während einer Wanderung (1920),1920,Europa,CH,,,,
318,Sozarch_F_5000-Fx-316,Wandervögel bei einer Rast (vermutlich) während einer Wanderung (1920),1920,Europa,CH,,,,
319,Sozarch_F_5000-Fx-317,Tanzende Wandervögel (an einer Landsgemeinde?) (1920),1920,Europa,CH,,,,
320,Sozarch_F_5000-Fx-318,"Gruppenporträt dreier Wandervögel auf der zum Teil verschneiten Wiese, ein Wandervogel uniformiert (Militäruniform?) (1918)",1918,Europa,CH,,,,
